序号,热搜话题词,在榜时长,打标类型,
1,上海迪士尼新年特别版烟花秀,583,景色场景,
2,冬日喀纳斯宛如白色童话世界,9,景色场景,
3,天梯烟花,84,景色场景,
4,总要去湖南看一次烟花秀吧,513,景色场景,
5,赵丽颖说幸福是有梦想有希望,188,明星热点,
6,深海梦幻,93,影视热点,
7,烟花不是只属于夜晚的,104,景色场景,
8,被现实版童话村治愈到了,19,景色场景,
9,主人举着猫咪一起看烟花,133,生活时事,
10,仙女棒在橘子里不会灭,430,生活时事,
11,烟花真的会给人带来幸福感,248,生活时事,
12,明星烟花氛围感随拍,22,明星热点,
13,哈尔滨冰雪大世界夜景有多梦幻,154,景色场景,
14,秦岭冰瀑雾凇同框美若童话,1,景色场景,
15,和喜欢的人住进梦想的家,-,生活时事,
16,诗人笔下的城市有多梦幻,41,生活时事,
17,秦岭梦幻金色日出,1,景色场景,
18,祝绪丹穿公主裙走秀,337,明星热点,
19,陈卓璇梦幻光影蝴蝶造型,19,明星热点,
20,INTO1烟花回眸氛围感,23,明星热点,
21,李一桐是公主吧,142,明星热点,
22,妈妈用废纸壳为女儿搭出童话世界,304,生活时事,
23,她是从童话里走出来的吧,153,影视热点,
24,哈利波特的魔法惊喜,259,影视热点,
25,欧阳娜娜梦幻波点大片,13,明星热点,
26,免签就能去的最梦幻之地,121,景色场景,
27,童话里走出来的王子公主,-,明星热点,
28,高叶说走到戛纳像做梦,55,明星热点,
29,公主小妹照进现实,750,影视热点,
30,满足了我对公主所有的幻想,143,影视热点,
31,杨紫复古梦幻大片预告,65,明星热点,
32,孙珍妮古堡公主,314,明星热点,
33,雨后西安上空出现橙色童话云,21,景色场景,
34,赵露思手电筒烟花好浪漫,344,明星热点,
35,蒙古包迁移宛如进入童话世界,18,景色场景,
36,段嘉许桑稚看的是同一场烟花,115,影视热点,
37,一方水土养一方白雪公主,34,生活时事,
38,大运会烟花,4,赛事热点,
39,赵露思童话剧照,1,明星热点,
40,肖战手画烟花太浪漫了,200,明星热点,
41,九寨沟秋天下雪变身童话世界,45,景色场景,
42,苏州太湖湾上演大型绝美烟花秀,11,景色场景,
43,冬天哈尔滨像开了魔法滤镜,2,景色场景,
44,刘亦菲晒玩仙女棒随拍,8,明星热点,
45,做梦都想去东北玩雪,17,景色场景,
46,天鹅群在霞光晨雾中起舞美如童话,17,景色场景,
47,萤火虫在森林起舞宛如童话世界,3,景色场景,
48,男子为200只流浪猫打造梦幻乐园,6,生活时事,
49,原来童话里的家庭真的存在,74,生活时事,
50,妈妈施展了她的魔法,13,生活时事,
51,原来大自然真的有魔法,27,景色场景,
52,隔着窗户给小猫看烟花,1,生活时事,
53,孩子手中的塑料袋充满了亿点点魔法,1,生活时事,
54,广州无人机烟花秀为亚运加油,54,赛事热点,
55,从缫丝开始实现仙女梦,2,生活时事,
56,在西湖遇到了真公主,80,生活时事,
57,环卫大爷为圆梦零基础学芭蕾,19,生活时事,
58,韩国奶奶坐轮椅圆梦杭州动物园,38,生活时事,
59,爷爷用私房钱圆了奶奶公主梦,147,生活时事,
60,小姑娘用荷叶装饰大学路灯秒入童话世界,23,生活时事,
61,王心凌波光粼粼公主裙,1,明星热点,
62,飞机飞过七彩祥云好梦幻,35,景色场景,
63,娜扎这几步好像芭蕾公主,78,明星热点,
64,2005年除夕夜的烟花,117,景色场景,
65,烟花美甲,90,生活时事,
66,霍格沃茨魔法狗校的入口,88,影视热点,